{
  "algorithm": "Ed25519",
  "digest": "sha256:cfbf031f03347fa82d0428181c6216cf81bbdfa22c9247ecc6b9ae78e5e893a0",
  "format": "slime-signature/1",
  "purpose": "set",
  "signature": "noTotPV4NP7Fu6eA3jVlzsctVM0N7moa9x6eVsk9Ewf_PpYNA0B4FsbWCStHjXMzDMHH3P073uCWTu2oZQ-aDA",
  "signer": "8nwd7x787d4xxy6r349npowdz136ibmmnpmyk1m8oxw6faa6oigy"
}
