{
  "algorithm": "Ed25519",
  "digest": "sha256:66d838dcfe4d12b69a2a20b77c7aa040950495d43e1b3bf590d83e389f3c957a",
  "format": "slime-signature/1",
  "purpose": "provider",
  "signature": "L9U1JmhEBZi4xinqaPL52wdxrE-53_hnyUwu9qeloDth8m3bBSuES2mIaclUCKehoGK1pwm26TGrO0WoqWS0Dg",
  "signer": "pczjo5k55rbz55ceohtso7mrmbc74senpsthsrs9i7js6socbbpy"
}
