{
  "algorithm": "Ed25519",
  "digest": "sha256:0f1350920bfc42293d6f840cde0c115f9cebaeb738dacf34b94749d4c42b7a30",
  "format": "slime-signature/1",
  "purpose": "set",
  "signature": "DbbpQH9j0W-1lafCOkxE0iVexak-ej7LlVdK3i2QCQUqFNw5YLgoYtlXfLPIqZ4bzcghT3YHo7Sp9Ahm_1rLDg",
  "signer": "8nwd7x787d4xxy6r349npowdz136ibmmnpmyk1m8oxw6faa6oigy"
}
