{
  "algorithm": "Ed25519",
  "digest": "sha256:16bc3c52d9476757938e11a725a6eff13bf11d2e8eb33c08b77300fb7188d158",
  "format": "slime-signature/1",
  "purpose": "set",
  "signature": "C2Cqel3trNsGBrIsNfV_wQskdNbeN4ZaNd1TI7k_8FgBX9ZoraiNi0ouUa_y_fgvi4veCGA2i-6Zq-hqQpLyDQ",
  "signer": "8nwd7x787d4xxy6r349npowdz136ibmmnpmyk1m8oxw6faa6oigy"
}
